{
  "packet_kind": "budget_vs_actual",
  "book_id": "book-1",
  "budget_id": "budget-1",
  "start_date": "2026-01-01",
  "end_date": "2026-01-31",
  "decimal_places": 2,
  "rows": [
    {
      "account_id": "acct-1",
      "account_number": "1000",
      "account_name": "Cash",
      "budget": "1000.00",
      "actual_debit": "1200.00",
      "actual_credit": "0.00",
      "actual_net": "1200.00",
      "variance": "200.00"
    }
  ]
}
